{
    "id": "song-home-on-the-range",
    "version": 1,
    "reviewed": false,
    "title": {"en": "Home on the Range"},
    "units": [
        {
            "id": "song-home-on-the-range-soprano",
            "title": {"en": "The melody"},
            "colour": 1,
            "lessons": [
                {
                    "id": "song-home-on-the-range-soprano-1",
                    "title": {"en": "Hear it"},
                    "strictness": "relaxed",
                    "steps": [
                        {
                            "kind": "learn",
                            "headline": {"en": "Home on the Range: hear the whole song first, then the tune on its own."},
                            "steps": [
                                {"title": {"en": "Listen before you sing"}, "detail": {"en": "The whole song, every part together"}},
                                {"title": {"en": "Then the tune"}, "detail": {"en": "The guide sings it, line by line"}},
                                {"title": {"en": "Sing gently"}, "detail": {"en": "Stop if anything tightens or hurts"}}
                            ],
                            "listen": {
                                "song": {
                                    "template": "home-on-the-range",
                                    "part": "soprano",
                                    "phrases": [0, 1, 2, 3, 4, 5, 6, 7],
                                    "with": "others"
                                },
                                "turn": false
                            }
                        },
                        {
                            "kind": "learn",
                            "headline": {"en": "Now the tune on its own."},
                            "steps": [{"title": {"en": "Soprano"}, "detail": {"en": "Follow the words as it plays"}}],
                            "listen": {
                                "song": {
                                    "template": "home-on-the-range",
                                    "part": "soprano",
                                    "phrases": [0, 1, 2, 3, 4, 5, 6, 7]
                                },
                                "turn": false
                            }
                        },
                        {
                            "kind": "try",
                            "text": {"en": "Find the notes of line 1: each one waits until you're on it."},
                            "exercise": {
                                "song": {
                                    "template": "home-on-the-range",
                                    "part": "soprano",
                                    "phrases": [0]
                                }
                            }
                        }
                    ]
                },
                {
                    "id": "song-home-on-the-range-soprano-2",
                    "title": {"en": "Lines 1 to 3"},
                    "strictness": "relaxed",
                    "steps": [
                        {
                            "kind": "play",
                            "text": {"en": "Hear line 1, then sing it back."},
                            "exercise": {
                                "song": {
                                    "template": "home-on-the-range",
                                    "part": "soprano",
                                    "phrases": [0]
                                },
                                "turn": true
                            },
                            "measures": {"en": "Scored on the notes."}
                        },
                        {
                            "kind": "play",
                            "text": {"en": "Hear line 2, then sing it back."},
                            "exercise": {
                                "song": {
                                    "template": "home-on-the-range",
                                    "part": "soprano",
                                    "phrases": [1]
                                },
                                "turn": true
                            },
                            "measures": {"en": "Scored on the notes."}
                        },
                        {
                            "kind": "play",
                            "text": {"en": "Line 3 is the tune of line 1 again, with new words. Sing it with the guide."},
                            "exercise": {
                                "song": {
                                    "template": "home-on-the-range",
                                    "part": "soprano",
                                    "phrases": [2]
                                },
                                "turn": false
                            },
                            "measures": {"en": "Scored on the notes."}
                        },
                        {
                            "kind": "play",
                            "text": {"en": "Now lines 1 to 3 joined, with the guide."},
                            "exercise": {
                                "song": {
                                    "template": "home-on-the-range",
                                    "part": "soprano",
                                    "phrases": [0, 1, 2]
                                },
                                "turn": false
                            },
                            "measures": {"en": "Scored on the notes."}
                        }
                    ]
                },
                {
                    "id": "song-home-on-the-range-soprano-3",
                    "title": {"en": "Lines 4 and 5"},
                    "strictness": "relaxed",
                    "steps": [
                        {
                            "kind": "play",
                            "text": {"en": "Hear line 4, then sing it back."},
                            "exercise": {
                                "song": {
                                    "template": "home-on-the-range",
                                    "part": "soprano",
                                    "phrases": [3]
                                },
                                "turn": true
                            },
                            "measures": {"en": "Scored on the notes."}
                        },
                        {
                            "kind": "play",
                            "text": {"en": "Hear line 5, then sing it back."},
                            "exercise": {
                                "song": {
                                    "template": "home-on-the-range",
                                    "part": "soprano",
                                    "phrases": [4]
                                },
                                "turn": true
                            },
                            "measures": {"en": "Scored on the notes."}
                        },
                        {
                            "kind": "play",
                            "text": {"en": "Now lines 4 and 5 joined: hear them, then sing them back."},
                            "exercise": {
                                "song": {
                                    "template": "home-on-the-range",
                                    "part": "soprano",
                                    "phrases": [3, 4]
                                },
                                "turn": true
                            },
                            "measures": {"en": "Scored on the notes."}
                        }
                    ]
                },
                {
                    "id": "song-home-on-the-range-soprano-4",
                    "title": {"en": "Lines 6 to 8"},
                    "strictness": "relaxed",
                    "steps": [
                        {
                            "kind": "play",
                            "text": {"en": "Hear line 6, then sing it back."},
                            "exercise": {
                                "song": {
                                    "template": "home-on-the-range",
                                    "part": "soprano",
                                    "phrases": [5]
                                },
                                "turn": true
                            },
                            "measures": {"en": "Scored on the notes."}
                        },
                        {
                            "kind": "play",
                            "text": {"en": "Hear line 7, then sing it back."},
                            "exercise": {
                                "song": {
                                    "template": "home-on-the-range",
                                    "part": "soprano",
                                    "phrases": [6]
                                },
                                "turn": true
                            },
                            "measures": {"en": "Scored on the notes."}
                        },
                        {
                            "kind": "play",
                            "text": {"en": "Hear line 8, then sing it back."},
                            "exercise": {
                                "song": {
                                    "template": "home-on-the-range",
                                    "part": "soprano",
                                    "phrases": [7]
                                },
                                "turn": true
                            },
                            "measures": {"en": "Scored on the notes."}
                        },
                        {
                            "kind": "play",
                            "text": {"en": "Now lines 6 to 8 joined, with the guide."},